{"build_arguments":["build-number=1","official-release=False","monitor-diagnostics=False","compiler-debug-information=embedded","tests-enabled=true"],"canonicalization":"rs-canonical-json-v1","configuration":"Debug","duration_ms":228271,"ended_utc":"2026-10-16T14:40:49.9817378Z","exit_code":0,"ghostty_runtime_identity":"6f424ef4ec8476339d391b2758d5ab164b2f52e6ca4bada47e331ecd1faa4701","git_head":"9fb487f6f8474658c2899bbaf650d0a7ede12b3b","official_release":false,"outputs":[{"absolute_path_diagnostic":"Z:\\src\\RedSalamander\\.build\\x64\\Debug\\asan.supp","id":"artifact.a5295ad928dca1b73dfc2fc6","relative_path":".build/x64/Debug/asan.supp","role":"runtime-data","runtime_closure":[],"sha256":"c1e6bf2b4c6b8d58782a400973cf87e3b96f159124b395f9059f85a33d12bd20","size_bytes":815},{"absolute_path_diagnostic":"Z:\\src\\RedSalamander\\.build\\x64\\Debug\\blake3.dll","id":"artifact.e64e6488c46450c27be6c521","relative_path":".build/x64/Debug/blake3.dll","role":"library","runtime_closure":[],"sha256":"e62f92961d71898e70b86372456f359555e43b9dcfdb3a9359f8b701fcf4f491","size_bytes":142336},{"absolute_path_diagnostic":"Z:\\src\\RedSalamander\\.build\\x64\\Debug\\Common.dll","id":"artifact.404f900248b8f2da15d9ec73","relative_path":".build/x64/Debug/Common.dll","role":"library","runtime_closure":[".build/x64/Debug/blake3.dll",".build/x64/Debug/Common.dll",".build/x64/Debug/yyjson.dll"],"sha256":"d1565e049718a7b226e157d048b025205df3fe73487fe037e262b372cbd0d09b","size_bytes":3907072},{"absolute_path_diagnostic":"Z:\\src\\RedSalamander\\.build\\x64\\Debug\\CrashHandlingTests.exe","id":"artifact.b5d223d76d1e83b8c48d6b21","relative_path":".build/x64/Debug/CrashHandlingTests.exe","role":"test","runtime_closure":[".build/x64/Debug/CrashHandlingTests.exe"],"sha256":"d0e185c252b7b6d606cccb648a85426298401b8b1b14a033c355e5d0c4f0cd94","size_bytes":1824256},{"absolute_path_diagnostic":"Z:\\src\\RedSalamander\\.build\\x64\\Debug\\FileSystemCurlTests.exe","id":"artifact.ee881f6f59a493a6564e1726","relative_path":".build/x64/Debug/FileSystemCurlTests.exe","role":"test","runtime_closure":[".build/x64/Debug/FileSystemCurlTests.exe"],"sha256":"78191f2a5eef2e30432e612023cd9b1d3f9d4480ee1c4a4202223183eece9c9f","size_bytes":1433088},{"absolute_path_diagnostic":"Z:\\src\\RedSalamander\\.build\\x64\\Debug\\FlipSequentialDiscard.exe","id":"artifact.230bfbde3fe37076df2bf3bc","relative_path":".build/x64/Debug/FlipSequentialDiscard.exe","role":"test","runtime_closure":[".build/x64/Debug/FlipSequentialDiscard.exe"],"sha256":"fe08c520195567795f5ec2fb9d9696ded3ddd9af62b082e70ef76c9952691ae8","size_bytes":1461760},{"absolute_path_diagnostic":"Z:\\src\\RedSalamander\\.build\\x64\\Debug\\Lang\\FileSystem-cs-CZ.dll","id":"artifact.6341deb1930076a0ab0b8854","relative_path":".build/x64/Debug/Lang/FileSystem-cs-CZ.dll","role":"library","runtime_closure":[".build/x64/Debug/Lang/FileSystem-cs-CZ.dll"],"sha256":"45b982bdac9c65f8ab45cab9d26fadd0fb88f8938860d4c0b6e968cca9acfab1","size_bytes":3584},{"absolute_path_diagnostic":"Z:\\src\\RedSalamander\\.build\\x64\\Debug\\Lang\\FileSystem-fr-FR.dll","id":"artifact.1a13d8da2d968cd26f815122","relative_path":".build/x64/Debug/Lang/FileSystem-fr-FR.dll","role":"library","runtime_closure":[".build/x64/Debug/Lang/FileSystem-fr-FR.dll"],"sha256":"5c48c2d382a799b2e766661870b56ebbb656fbf98d00cc9abc8f657f576f9818","size_bytes":3584},{"absolute_path_diagnostic":"Z:\\src\\RedSalamander\\.build\\x64\\Debug\\Lang\\FileSystem-ja-JP.dll","id":"artifact.6f10e2b2c0f3e22665378349","relative_path":".build/x64/Debug/Lang/FileSystem-ja-JP.dll","role":"library","runtime_closure":[".build/x64/Debug/Lang/FileSystem-ja-JP.dll"],"sha256":"835ff832309c1d1b397c46413dda01ac7393026471578295f18707f3b055895d","size_bytes":3584},{"absolute_path_diagnostic":"Z:\\src\\RedSalamander\\.build\\x64\\Debug\\Lang\\FileSystem-sk-SK.dll","id":"artifact.29f3dda15053af53d7f1ba9e","relative_path":".build/x64/Debug/Lang/FileSystem-sk-SK.dll","role":"library","runtime_closure":[".build/x64/Debug/Lang/FileSystem-sk-SK.dll"],"sha256":"5dbeeca8c924fcaf5c32573181dcadc98f4d94eecef100529a37537c1292070b","size_bytes":3584},{"absolute_path_diagnostic":"Z:\\src\\RedSalamander\\.build\\x64\\Debug\\Lang\\FileSystem7z-cs-CZ.dll","id":"artifact.78b00ca55f0bdc12c83b0f54","relative_path":".build/x64/Debug/Lang/FileSystem7z-cs-CZ.dll","role":"library","runtime_closure":[".build/x64/Debug/Lang/FileSystem7z-cs-CZ.dll"],"sha256":"657ca1cdb0a4ad02dcbb67e0569f066c978885b8ad0a69aee4d215f72cce7cdd","size_bytes":3584},{"absolute_path_diagnostic":"Z:\\src\\RedSalamander\\.build\\x64\\Debug\\Lang\\FileSystem7z-fr-FR.dll","id":"artifact.bc0629e02f401420ca3ec369","relative_path":".build/x64/Debug/Lang/FileSystem7z-fr-FR.dll","role":"library","runtime_closure":[".build/x64/Debug/Lang/FileSystem7z-fr-FR.dll"],"sha256":"4e33d31e786dcb1fe4d81b5341692edaedf05ed86c8860c9d7118db8d4b90fc4","size_bytes":3584},{"absolute_path_diagnostic":"Z:\\src\\RedSalamander\\.build\\x64\\Debug\\Lang\\FileSystem7z-ja-JP.dll","id":"artifact.cd66f8b8fe115d1923be78c7","relative_path":".build/x64/Debug/Lang/FileSystem7z-ja-JP.dll","role":"library","runtime_closure":[".build/x64/Debug/Lang/FileSystem7z-ja-JP.dll"],"sha256":"a6ac16b37fda4baca94be782a62295e4fa8c675d0edfdb3abedd685fd3e770d8","size_bytes":3584},{"absolute_path_diagnostic":"Z:\\src\\RedSalamander\\.build\\x64\\Debug\\Lang\\FileSystem7z-sk-SK.dll","id":"artifact.379a5109a550e848ee82e6ed","relative_path":".build/x64/Debug/Lang/FileSystem7z-sk-SK.dll","role":"library","runtime_closure":[".build/x64/Debug/Lang/FileSystem7z-sk-SK.dll"],"sha256":"50f5f60a065b1dfdf9f415e4246fbb349d441cb56971bf5f28cfae8ee2ffbb25","size_bytes":3584},{"absolute_path_diagnostic":"Z:\\src\\RedSalamander\\.build\\x64\\Debug\\Lang\\FileSystemCurl-cs-CZ.dll","id":"artifact.9cbb59765968a6dc750bf73f","relative_path":".build/x64/Debug/Lang/FileSystemCurl-cs-CZ.dll","role":"library","runtime_closure":[".build/x64/Debug/Lang/FileSystemCurl-cs-CZ.dll"],"sha256":"090189ba75797c9d38dc5706dabbf0bba15a688f0e0e1b2fc443b3dd5cb5cf42","size_bytes":4096},{"absolute_path_diagnostic":"Z:\\src\\RedSalamander\\.build\\x64\\Debug\\Lang\\FileSystemCurl-fr-FR.dll","id":"artifact.b8f69ecde496272a724a4a80","relative_path":".build/x64/Debug/Lang/FileSystemCurl-fr-FR.dll","role":"library","runtime_closure":[".build/x64/Debug/Lang/FileSystemCurl-fr-FR.dll"],"sha256":"8956c6b1e19494f26f10e943f945c6c355b5d70bf58cd5163a1b94367a6ad078","size_bytes":4608},{"absolute_path_diagnostic":"Z:\\src\\RedSalamander\\.build\\x64\\Debug\\Lang\\FileSystemCurl-ja-JP.dll","id":"artifact.a3c07062ff48e5541b7801eb","relative_path":".build/x64/Debug/Lang/FileSystemCurl-ja-JP.dll","role":"library","runtime_closure":[".build/x64/Debug/Lang/FileSystemCurl-ja-JP.dll"],"sha256":"8c3d209ae902ea85fc697b11792c9227a4a609021a892ec1a7b7d83d38d8bf91","size_bytes":4096},{"absolute_path_diagnostic":"Z:\\src\\RedSalamander\\.build\\x64\\Debug\\Lang\\FileSystemCurl-sk-SK.dll","id":"artifact.2b5a8733c51862cfb8a6f53e","relative_path":".build/x64/Debug/Lang/FileSystemCurl-sk-SK.dll","role":"library","runtime_closure":[".build/x64/Debug/Lang/FileSystemCurl-sk-SK.dll"],"sha256":"ebc35fdf700db9136410c2024713ce8c4e4f452d41bcc1edb1050955da867718","size_bytes":4096},{"absolute_path_diagnostic":"Z:\\src\\RedSalamander\\.build\\x64\\Debug\\Lang\\FileSystemDummy-cs-CZ.dll","id":"artifact.8d62d64fe311e0e3a71ca4ed","relative_path":".build/x64/Debug/Lang/FileSystemDummy-cs-CZ.dll","role":"library","runtime_closure":[".build/x64/Debug/Lang/FileSystemDummy-cs-CZ.dll"],"sha256":"2f5d1e61f3ae7951139f499bb97f0b72e738eec11ffc598222f425d812baf2d1","size_bytes":3584},{"absolute_path_diagnostic":"Z:\\src\\RedSalamander\\.build\\x64\\Debug\\Lang\\FileSystemDummy-fr-FR.dll","id":"artifact.bc2e33819894b94749ead97d","relative_path":".build/x64/Debug/Lang/FileSystemDummy-fr-FR.dll","role":"library","runtime_closure":[".build/x64/Debug/Lang/FileSystemDummy-fr-FR.dll"],"sha256":"4046fddae9156501e9093e74d04f12d4ecb586446d0cc26a4b30b0fb87f64da3","size_bytes":3584},{"absolute_path_diagnostic":"Z:\\src\\RedSalamander\\.build\\x64\\Debug\\Lang\\FileSystemDummy-ja-JP.dll","id":"artifact.bcc72738dea9f3cce5b49945","relative_path":".build/x64/Debug/Lang/FileSystemDummy-ja-JP.dll","role":"library","runtime_closure":[".build/x64/Debug/Lang/FileSystemDummy-ja-JP.dll"],"sha256":"9b5f5d60349bc3dac44f49b81b483a6c6be201d858ffd4f09cd358eaee236984","size_bytes":3584},{"absolute_path_diagnostic":"Z:\\src\\RedSalamander\\.build\\x64\\Debug\\Lang\\FileSystemDummy-sk-SK.dll","id":"artifact.85292b7c705d0a3060985f5f","relative_path":".build/x64/Debug/Lang/FileSystemDummy-sk-SK.dll","role":"library","runtime_closure":[".build/x64/Debug/Lang/FileSystemDummy-sk-SK.dll"],"sha256":"37d2ae781ea3138c72dd18fff14a0fa5f33dfa13ef7bf6b415dc44f10f0a561f","size_bytes":3584},{"absolute_path_diagnostic":"Z:\\src\\RedSalamander\\.build\\x64\\Debug\\Lang\\FileSystemGoogleDrive-cs-CZ.dll","id":"artifact.4546f1820af6e4f4984dd96e","relative_path":".build/x64/Debug/Lang/FileSystemGoogleDrive-cs-CZ.dll","role":"library","runtime_closure":[".build/x64/Debug/Lang/FileSystemGoogleDrive-cs-CZ.dll"],"sha256":"8f45d11def1e12500dced3869502b79c1d725ba24e5d5697d9e75850be013b3c","size_bytes":4096},{"absolute_path_diagnostic":"Z:\\src\\RedSalamander\\.build\\x64\\Debug\\Lang\\FileSystemGoogleDrive-fr-FR.dll","id":"artifact.236f1b58568ee54d4661f1db","relative_path":".build/x64/Debug/Lang/FileSystemGoogleDrive-fr-FR.dll","role":"library","runtime_closure":[".build/x64/Debug/Lang/FileSystemGoogleDrive-fr-FR.dll"],"sha256":"a38ab90cfb25d3ac238ad010b2591110f30817460e1b6ad9e21583d8468a0f98","size_bytes":4096},{"absolute_path_diagnostic":"Z:\\src\\RedSalamander\\.build\\x64\\Debug\\Lang\\FileSystemGoogleDrive-ja-JP.dll","id":"artifact.d656c8e04bb9b6fede1d29b0","relative_path":".build/x64/Debug/Lang/FileSystemGoogleDrive-ja-JP.dll","role":"library","runtime_closure":[".build/x64/Debug/Lang/FileSystemGoogleDrive-ja-JP.dll"],"sha256":"98b189173b2710574e6fd16